,name,address,plz,ort,rooms,sqm,price,currency,description,gemeinde,latlong,kreis,lat,long,pricesqm
0,Sonniges Haus im Grünen,Ruchackerstrasse 14,8046.0,Zürich,5.0,100.0,3200.0,CHF,"Dieses gemütliche Heim liegt an einer sonnigen, ruhigen Lage zwischen Oerlikon und Affoltern, Bus- und Tramverbindung in der Nähe. Die Terrasse und der grosszügige Garten laden zum Verweilen und kreativer Gestaltung ein.- Ruhige Lage in sympathischer Umgebung- Kurze Distanz zu Einkaufsmöglichkeiten und Bahnhof Oerlikon- Sonnige Terrasse und Garten- Separate, abgeschlossene, pflegeleichte Küche - Offenes Wohn- und Esszimmer mit Parkett- Zusätzliches Gäste-WC- Obergeschoss: 3 Schlafzimmer mit grossem Badezimmer- Estrich mit praktischen Einbauschränken- Untergeschoss: Keller und ein geräumiger WaschraumMelden Sie sich bitte Kontaktformular, ich freue mich.","Zürich, Kreis 11","(47.4123975, 8.5272154)",1,47.4123975, 8.5272154,32.0
1,Ihr Geschenk: 1 Monat gratis wohnen,Gutstrasse 159,8047.0,Zürich,3.5,103.0,3245.0,CHF,"Modernes Eck-Reihen-EFH am Fusse des Zürcher Hausbergs!Diese helle und top moderne 3.5 Zimmer-Eck-Reihen-EFH bietet Ihnen nebst der attraktiven Lage folgende Annehmlichkeiten:- ganze Wohnung mit Parkettboden Eiche rustikal- top moderne Küche- Glaskeramikherd und Geschirrspüler- Bad/WC und Dusche/WC- eigener Waschturm- KellerabteilDie genaue Raumaufteilung entnehmen Sie bitte dem Grundriss.Ein Einstellplatz kann bei Bedarf für Fr. 160.- pro Monat dazu gemietet werden.Einkaufsmöglichkeiten und der öffentliche Verkehr mit der Haltestelle ""Im Gut"" (Bus 67 und 89) befinden sich praktisch vor der Haustüre. Der Kindergarten Gutstrasse ist nur wenige Meter von der Liegenschaft entfernt. Und auch das Schulhaus Letzi ist zu Fuss gut erreichbar.Bei eine Mindestvertragsdauer von einem Jahr schenken wir Ihnen einen Gratismonat (Nettomiete).Eine Besichtigung lohnt sich. Gerne vereinbaren wir einen Besichtigungstermin.                        
                                    Zusatzinformationen im Web","Zürich, Kreis 9","(47.3737493, 8.5023375)",9,47.3737493, 8.5023375,31.50485436893204
2,Schönes Haus mit Umschwung und grossartiger Fernsicht,Ottenbergstrasse 27,8049.0,Zürich,7.5,164.0,4990.0,CHF,Wir vermieten ein 7.5-Zimmerhaus mit grossem Garten in Zürich-Höngg. Das Haus überzeugt nebst dem grosszügigen Umschwung und sonniger Lage unter anderem mit einer eindrücklichen Aussicht über die ganze Stadt Zürich. Diese Liegenschaft ist ideal für eine Familie mit Kindern. Trotz Stadtnähe ist es im Garten ruhig und erholsam. Das Naherholungsgebiet Hönggerberg ist in wenigen Gehminuten erreichbar.Lage / Infrastruktur:Öffentliche Verkehrsmittel: 1 bzw. 5 Gehminuten Einkaufsmöglichkeiten: ca. 15 Gehminuten Schulen: ca. 10-15 Gehminuten Naherholungsgebiet: 10-15 Gehminuten ETH: 15 Minuten mit ÖV HB Zürich: 15min mit ÖV Hallenbad Bläsi / Sporthalle: 5min mit ÖV Vorteilhafte Anforderungen an die zukünftigen Mieter: Freude und Flair für den Unterhalt des grossen Gartens.Haben wir Ihr Interesse geweckt?Dann zögern Sie nicht und kontaktieren Sie uns. Gerne vereinbaren wir einen Besichtigungstermin. Wir freuen uns auf Sie!,"Zürich, Kreis 10","(47.3970104, 8.51118643024845)",1,47.3970104, 8.51118643024845,30.426829268292682
3,4.5 Zimmerwohnung zu vermieten...,Im Glockenacker 65,8053.0,Zürich,4.5,85.0,1950.0,CHF,Per 01.08.2017 vermieten wir diese schöne 4.5 Zimmerwohnung im 2.OG an ruhiger Lage.Die Wohnung verfügt über folgenden Ausbaustandard: Küche mit Geschirrspüler Korridor und Zimmer mit Parkettboden Badezimmer mit Badewanne separate Dusche WC BalkonDie Liegenschaft ist eingebettet in grüne Natur. Das Zentrum Wittikon mit diversen Einkaufsmöglichkeiten ist in ca. 15 Gehmituten erreichbar. Die Bushaltestelle mit Verbindungen nach Schwerzenbach sowie nach Zürich ist nur wenige Meter entfernt.Haben wir Ihr Interesse geweckt? Dann Kontaktieren Sie Frau Wolfensebrger zu Bürozeiten unter der Nummer 058 715 63 78.,"Zürich, Kreis 7","(47.360768, 8.60155913784341)",7,47.360768, 8.60155913784341,22.941176470588236
4,Modernes 3.5 Zimmer-Reihenhaus mit Gartensitzplatz zu vermieten,Heerenschürlistrasse 4A,8051.0,Zürich,3.5,98.0,2700.0,CHF,"Wir vermieten per 01.08.2017 dieses wunderschöne 3.5-Zimmer-Reihenfamilienhaus. Die Liegenschaft Altwiesen wurde im Jahr 2014 erbaut und bietet Ihnen nebst der topmodernen Ausstattung (Minergie-Standard, Bodenheizung, hochwertige Materialien) und der hervorragenden Infrastruktur die folgende Ausstattung:- Wohn- und Schlafzimmer mit Parkettboden Eiche matt- Bad mit Steinzeugmosaik dunkel- grosszügiger und heller Wohn-/Essbereich- offene Küche mit moderner Ausstattung- mit Glaskeramikherd- mit Geschirrspüler- modernes Badezimmer mit Badewanne- separate Dusche mit WC- eigener Waschturm im kleinen Reduit im 1. OG- kein Kellerabteil- grosszügiges Reduit anstelle des Kellers- GartensitzplatzEs handelt sich um Musterbilder, die den Ausbaustandard zeigen. Weitere Bilder und Informationen zur Liegenschaft finden Sie auf www.altwiesen.ch.Die genaue Raumaufteilung entnehmen Sie bitte dem Grundriss.Ein Einstellplatz kann für Fr. 140.00 pro Monat dazu gemietet werden.Die vielseitige Sportanlage Herrenschürli, Jogging-Strecken, das Einkaufszentrum Glatt, Dienstleistungen aller Art, Restaurants und Spazierwege im Grünen, das alles befindet sich unweit Ihres neuen Zuhauses.Die Liegenschaft Altwiesen liegt für Benutzer des öffentlichen Verkehrs perfekt: S-Bahnhof Stettbach mit Direktverbindungen Richtung Hauptbahnhof und Stadelhofen, zwei Tramlinien, die Glatttalbahn direkt zum Flughafen Zürich, mehrere Buslinien – alles ist in wenigen Minuten erreichbar. Autofahrer erreichen den Anschluss zur Autobahn in ca. 5 Minuten.Haben wir Ihr interesse geweckt?Dann zögern Sie nicht und kontaktieren Sie uns, um einen Besichtigungstermin zu vereinbaren.Wir freuen uns auf Sie!                        
                                    Zusatzinformationen im Web","Zürich, Kreis 12","(47.4000061, 8.5919249)",1,47.4000061, 8.5919249,27.551020408163264
5,Viel Platz für Ihr Hobby,Schwandenholzstrasse 264,8046.0,Zürich,0.0,15.0,115.0,CHF,Die Liegenschaft Schwandenholz befindet sich in Zürich-Affoltern und ist mit dem öffentlichen sowie dem individual Verkehr gut errechbar. Der Raum verfügt über ein Fester sowie ein Lavabo und Steckdosen. Interessiert? Dann lohnt sich eine Besichtigung.,"Zürich, Kreis 11","(47.4247553, 8.51993110540345)",1,47.4247553, 8.51993110540345,7.666666666666667
6,3 Zimmer freie Wohnung ab Sofort in Zürich Seebach,Caspar-Wüststrasse 25,8052.0,Zürich,3.0,,1440.0,CHF,"Haben wir Ihr Interesse geweckt?  Dann freuen wir uns auf Ihre Kontaktaufnahme. Ab sofort oder nach Vereinbarung. Möglich. Für den Auftrag Geber ist eine einmalige Arbeits gebühr von 300 .- Fr geleistet werden. Bei der Anmeldung, Auch mit Betreibung möglich Sie können mich anrufen und Termin vereinbaren  TEL 0786595806","Zürich, Kreis 11","(47.4297182, 8.5429365)",1,47.4297182, 8.5429365,
8,7 Zimmer Reiheneinfamilienhaus mit Garten,Strickhofstrasse 10,8057.0,Zürich,7.0,225.0,5200.0,CHF,"Wir suchen für unser Bijou auf den Juli 2017 (August 2017 ebenfalls möglich wenn gewünscht) neue Mieter, da der Vormieter auswandert.  Das Haus wurde 2014  komplett saniert und verfügt über einen kleinen Garten sowie einen Vorgarten. Zudem steht ein Glasfaseranschluss der Stadt Zürich zur Verfügung und es wurde ein LAN eingebaut!  Die Räume sind noch mit den originalen Parkettböden versehen und es wurde viel Wert auf eine sanfte Renovation gelegt.   Parterre:  Entree mit neuer Garderobe, schönes Atelier, grosser Werkraum und viel Platz im Keller. Dusche. Aufgang zum Garten.  1. Stock:  Küche, Gäste - WC und 3 Wohnräume - Ausgang zum Garten mit schönen Reben und kleiner Wiese.  2. Stock:  3 Schlafzimmer - topmodernes Bad - separates WC.   Dachstock:  grosser isolierter Dachstock mit vielen Nutzungsmöglichkeiten  Garten:  Vor dem Haus Garten mit vielen Zierpflanzen. Hinter dem Haus sehr schöne Gartenlaube mit Weinreben, einem separaten Platz, einem Apfelbaum und viel Beerensträuchern und einer Rodhodendronbepflanzung. Kleine Wiese vorhanden.  Sehr ruhiges Quartier in der Nähe des lrchelparkes und sehr gute Verkehrsanbindung mit verschiedenen Tramlinien (Haltestellen in Fusswegdistanz). Kurzer Fahrweg zur Autobahn. Einkaufsmoglichkeiten in der Nähe oder im Nahen Oerlikon. Gute Besonnung und Schulen in der Nähe. Kein eigener Parkplatz (kann jedoch in der Uniparkgarage gemietet werden / evtl. auch blaue Zone)  Gesucht werden Nachmieter mit längerfristigem Interesse (Familie bevorzugt). Besichtigung nach Rücksprache immer am Freitagnachmittag möglich.","Zürich, Kreis 6","(47.39509305, 8.54577019370229)",6,47.39509305, 8.54577019370229,23.11111111111111
9,Erstvermietung: 4 1/2 Zimmer Gartenwohnung an ruhiger Lage in Seebach,Ausserdorfstrasse 26,8052.0,Zürich,4.5,107.0,3350.0,CHF,An bevorzugter ruhiger Wohnlage in Zürich-Seebach vermieten wir diese traumhafte helle 4 1/2 Zimmer Gartenwohnung mit gehobenem Ausbaustandard. Hier einige Details zum komfortablen Ausbau: - grosszügiger Wohn/Essbereich - alle Zimmer mit Eichenparkett - Bodenheizung - moderne Küche mit Granitabdeckung - Glaskeramikherd - Geschirrspühler - Backofen / Steamer - Bad/WC und Dusche/WC - eigener  Waschturm in der Wohnung - Multimediaverkabelung in allen ZImmern - elektrische Storen - Terasse mit Umschwung - Kellerabteil - Veloabstellraum - Tiefgaragenplatz verfügbar für Fr. 150.00/Monat  Haben wir Ihr Interesse geweckt? Gerne können wir einen Besichtignugstermin vereinbaren.,"Zürich, Kreis 11","(47.50993765, 8.71297268754346)",1,47.50993765, 8.71297268754346,31.30841121495327
10,Studio an schöner Hanglage mit Aussicht auf die City,Tobeleggweg 34,8049.0,Zürich,1.0,25.0,885.0,CHF,An sonniger und ruhiger Wohnlage vermieten wir per 1.09.2017 in einem gepflegten Mehrfamilienhaus dieses praktische Studio.Die Wohnung hat folgendes zu bieten: Wohn- Schlafzimmer mit Parkettboden Einbauküche mit 2 Herdplatten Badezimmer mit Badewanne KellerabteilEine Waschküche und ein Trockenraum stehen zur Mitbenützung zur Verfügung. Haben wir Ihr Interesse geweckt? Dann zögern Sie nicht sich mit uns in Verbindung zu setzen.,"Zürich, Kreis 10","(47.3975483, 8.5018517)",1,47.3975483, 8.5018517,35.4
11,Motorradabstellplatz im Freien in Wollishofen,Mutschellenstr. 69a+b,8038.0,Zürich,0.0,,30.0,CHF,"Wir vermieten per sofort oder nach Vereinbarung einen Motorradplatz an der Mutschellenstrasse 69b in Zürich. Mietzins: CHF 30.00 exkl. MwSt. Bei Interesse dürfen Sie sich gerne an uns wenden. Wir freuen uns schon jetzt, Sie schon bald zu unseren geschätzten Mieter zählen zu dürfen.","Zürich, Kreis 2","(47.3528728, 8.5271436)",2,47.3528728, 8.5271436,
14,Verschiedene WG-Zimmer in Einfamilienhaus:,Kleinbühlstrasse 1,8052.0,Zürich,2.0,180.0,900.0,CHF,"5 Gehminuten vom Bahnhof OerlikonVerschiedene WG-Zimmer in Einfamilienhausriesiges Zimmer mit separatem Eingang und eigenem WC: Fr. 1200 inkl.mittleres Zimmer: Fr. 900 inkl.eine kleine gemeinsame Küche, kleineres Badschöner verwunschener Garten zur Exklusivbenutzungwegen Umbau befristeter Mietvertrag bis 01.09.17Besichtigungstermin nach Vereinbarung078/770 56 67 (nur SMS) oder ohenry@gmx.net","Zürich, Kreis 11","(47.4163025, 8.55011255630828)",1,47.4163025, 8.55011255630828,5.0
15,Gemüliches Reihenhaus,"Rudenzweg, 18",8048.0,Zürich,4.5,100.0,2900.0,CHF,"Biete per 15.Juli oder etwas früher, ein 4,5 Zimmer Reihenhaus mitten in der Stadt, mit Garten. Das Haus liegt direkt beim Einkaufszentrum Letzipark in Altstetten.Es ist für Familien ideal, 20er Zone Kinderfreundlich und Kindski, Hort, Schule direkt zu Fuss erreichbar. Das Haus liegt in einer kleinen Gemeinschaft und man denkt nicht, dass man mitten in der Stadt ist, nette Nachbarn und viel kreative Möglichkeiten.Der Garten inkl. Möbel, Hollywoodschaukel, Cheminee, Rasenmäher, Schlauch, Pflanzen kann gratis übernommen werden. Alle Beleuchtungen im und vor dem Haus sind inklusive, auch teilweise Möbel können übernommen werden, weil sie mit im Haus waren.Eigene Waschküche mit neuer Waschmaschine und Lufttrockener.Ein Keller ist auch dabei. Parkmöglichkeiten blaue Zone oder ein eigener Parkplatz vor dem Haus kann dazu gemietet werden.Nicht WG geeignetBus 83, 89, 95, in der nähe Busse 31, 32 72Tram 2, Tram 3 +8 sowie diverse Busse in alle Richtungen von ZH (Oerlikon, City usw.)Einkauf, 1 min LetziparkFr. 2900,- inkl. NK","Zürich, Kreis 9","(47.384853625, 8.4980124)",9,47.384853625, 8.4980124,29.0
17,Reihen - Einfamilienhaus mit Garten und Gartensitzplatz,Stotzstrasse 62,8041.0,Zürich,5.0,110.0,3250.0,CHF,"Das Reihenmittelhaus ist umgeben von einer grünen Oase und liegt an einer ruhigen Privatstrasse ohne Durchgangsverkehr. Vor dem Haus befindet sich ein Garten mit einem kleinen Gartensitzplatz sowie Gartenbeete wo ein Gemüsegarten angelegt werden kann. Wasser für die Bewässerung ist reichlich vorhanden von einem Brunnen welcher durch Regenwasser (Wasserspeicher) gespeist wird. Der eigentliche besonnte Gartensitzplatz mit viel Platz liegt auf der Südseite des Hauses mit direktem Zugang zum Wohnbereich.Im Eingangsgeschoss empfängt sie ein grosses Entrèe. Ebenfalls im Eingangsgeschoss befindet sich das Gäste WC mit Dusche und Waschmaschine mit Tumbler sowie Keller und Abstellraum. Mit dem Auto parkieren Sie bequem auf dem eigenen Parkplatz direkt vor dem Haus. Im Mietpreis ist der Parkplatz inbegriffen!Im Erdgeschoss befindet sich das das Wohn - und Esszimmer sowie die moderne Küche. Vom Wohnzimmer gelangt man direkt zum Gartensitzplatz.Die drei Schlafzimmer und das Badezimmer befindet sich im obersten Geschoss. Stauraum ist im Estrich genügend vorhandenLeimbach ist ein Quartier der Stadt Zürich und liegt am Fuss des Uetlibergs im Sihltal. Zusammen mit Enge und Wollishofen bilden sie den Kreis 2 der Stadt Zürich. Das Naherholungsgebiet Uetliberg und Felsenegg liegt direkt vor der HaustüreKreis 2Der Kreis 2 liegt eingebettet zwischen Zürichsee und Uetliberg. Seine Attraktivität erhält der Kreis durch seine Nähe zu den Naherholungsgebieten und zur Seeuferlinie. Durch den genossenschaftlichen Wohnungsbau wird das Quartier Leimbach seit einigen Jahren belebt. In der Enge entsteht mehr Platz für eine dichtere Bebauung. Das Manegg- und das Hürlimann-Areal, ehemalige Industrie- Standorte, werden zudem gut erschlossen.Quelle: www.stadt-zuerich.ch","Zürich, Kreis 2","(47.3317987, 8.51296627522046)",2,47.3317987, 8.51296627522046,29.545454545454547
18,Topmodernes Wohnatelier im Loftstil,Hagenholzstrasse 74,8050.0,Zürich,1.0,110.0,2000.0,CHF,"Ob sportbegeisterter Single oder unternehmenslustiges Pärchen folgende Vorzüge hat diese Wohnung und deren Umgebung zu bieten: grosszügiger und heller Raum offener Wohn- und Schlafbereiche (gut abtrennbar) mit Parkettboden grosse Glasfronten moderne, grosszügige Küche mit Glaskeramik und Geschirrspüler Bad/WC und separate DU/WC sonniger Gartensitzplatz in einem wachsenden, neuen Quartier, Nähe Glattpark in 20 Minuten mit den öffentlichen Verkehrsmitteln im Stadtkern  von Zürich Glatttalbahn und Tram in unmittelbarer Nähe Garagenplatz kann für CHF 160.00 monatlich dazu gemietet werdenHaben wir Ihr Interesse geweckt. Dann zögern Sie nicht, sich mit uns in Verbindung zu setzen.*Es handelt sich nicht um Originalbilder*","Zürich, Kreis 11","(47.4137729, 8.5567571)",1,47.4137729, 8.5567571,18.181818181818183
19,Motorradeinstellplätze im MainTower,Thurgauerstrasse 36/38,8050.0,Zürich,0.0,,45.0,CHF,"Im 2. Untergeschoss des MainTower vermieten wir per sofort oder nach Vereinbarung Motorradplätze zu einem Mietzins von CHF 45.00/Monat.Bei Interesse zögern Sie bitte nicht, uns zu kontaktieren. Wir haben bestimmt den für Sie passenden Motorradplatz im Angebot.","Zürich, Kreis 11","(47.4139978, 8.5514051)",1,47.4139978, 8.5514051,
20,Motorradabstellplatz in Zürich-Affoltern zu vermieten!,Schwandenholzstrasse 234-240,8046.0,Zürich,0.0,,25.0,CHF,"Per sofort oder nach Vereinbarung vermieten wir an der Schwandenholzstrasse 234 - 240, in 8046 Zürich einen Motorradabstellplatz in unserer Tiefgarage.Wenn Sie an diesem Mietobjekt interessiert sind, dürfen Sie sich gerne telefonisch unter der Nummer 044 878 77 68 oder per E-Mail unter nina.garamendi@bilfinger.com mit uns in Verbindung setzen.","Zürich, Kreis 11","(47.4224099, 8.5367685)",1,47.4224099, 8.5367685,
21,Motorradeinstellplätze am Seebacherplatz,Schaffhauserstrasse 472-476,8052.0,Zürich,0.0,12.0,45.0,CHF,"Wir vermieten Motorradeinstellplätze in der Halle beim Migros Seebach, an der Schaffhauserstrasse 472-476, 8052 Zürich. Verfügbar per sofort oder nach Vereinbarung. Mietzins monatlich: CHF 45.00 / exkl. 8 % MwStSind Sie interessiert? Betreffend einer Besichtigung rufen Sie bitte unseren Hauswart an, Herrn Giorgio, Tel. 044 321 64 66.","Zürich, Kreis 11","(47.3911555, 8.5356119)",1,47.3911555, 8.5356119,3.75
23,Motorradeinstellplatz zu vermieten!,Katzenbachstrasse 221 - 231,8052.0,Zürich,0.0,165.0,50.0,CHF,Wir vermieten per sofort oder nach Vereinbarung einen Motorradeinstellplatz in Zürich Seebach. Haben wir Ihr Interesse geweckt? Wir freuen uns auf Ihre Kontaktaufnahme.,"Zürich, Kreis 11","(47.4217111, 8.5485943)",1,47.4217111, 8.5485943,0.30303030303030304
24,Ihr Motorradparkplatz Nähe Bahnhof Oerlikon steht für Sie bereit!,Neunbrunnenstrasse 110-120,8050.0,Zürich,0.0,34.0,40.0,CHF,"Guten TagSind Sie auf der Suche nach einem Parkplatz für Ihr Motorrad??Kein Problem! Wir haben die Lösung:Bei uns können Sie Ihren persönlichen Parkplatz in einer Einstellhalle mieten. An der Neunbrunnenstrasse 110-140, 8050 Zürich haben wir noch freie Motorradparkplätze.Rufen Sie uns an und Ihr Parkplatz-Problem ist gelöst.Mietzins CHF 40.00 zuzüglich 8% MWSt.","Zürich, Kreis 11","(47.4156381, 8.5293338)",1,47.4156381, 8.5293338,1.1764705882352942
25,gemütliche Singlewohnung in lebhaftem Quartier,Militärstr. 105,8004.0,Zürich,1.0,29.0,1093.0,CHF,"- Küche und Bad wurde im Jahr 2012 saniert- Ganze Wohnung neu verlegter Riemenparkettboden- Schöne, offene Einbauküche mit 4-Platten Herd, grosser Kühlschrank- Schönes helles Bad miit Wanne, Spiegelschrank, Abluftventilator- Wandschrank im Korridor mit viel Stauraum- kein Balkon- Lift- Katzen und Hundehaltung nicht erlaubtDie Bilder sind nicht objektspezifisch","Zürich, Kreis 4","(47.3790011, 8.5288494)",4,47.3790011, 8.5288494,37.689655172413794
26,Freie Motorradeinstellplätze in Zürich-Oerlikon,Ruedi Walter-Str. 4a,8050.0,Zürich,0.0,27.0,50.0,CHF,Wir vermieten in der Liegenschaft Binzmühlepark in Zürich-Oerlikon für CHF 50.00 (exkl. MWST) Motorradplätze.,"Zürich, Kreis 11","(47.4154488, 8.5419266)",1,47.4154488, 8.5419266,1.8518518518518519
27,Möbliertes Zimmer im Herzen von Zürich - Furnished room in the heart of Zürich,Rautistrasse 12,8047.0,Zürich,1.0,20.0,1090.0,CHF,"Konditionen:Mietvertrag: CHF 1090 + einmalige Kaution CHF 2‘000+ einmalige Endreinigung CHF 150, Kündigungsfrist: 3 Monate (Doppelzimmer nur CHF 60 mehr)1 Monat Mietdauer: CHF 1'250+ einmalige Endreinigung CHF 150 (Doppelzimmer nur CHF 50 mehr)2- 3 Monate Mietdauer je: CHF 1'150+ einmalige Endreinigung CHF 150(Doppelzimmer nur CHF 50 mehr)Anmeldung: Online Anmeldung auf www.primestay.ch oder via Kontaktformular von hier Kontakt: Primestay Schweiz AG, zuerich@primestay.ch, +41 44 495 70 95 +41 79 800 70 95 Besichtigungstermine: Bitte vermerken Sie in Ihrer Anfrage einen Terminvorschlag, falls Sie gerne unser Primestay besichtigen möchten.  Wir sind unter der Woche von 8.00 - 12.00 Uhr & von 13.00 - 17.00 Uhr verfügbar. Terminanfragen ausserhalb dieser Zeiten nur nach spezieller Vereinbarung.-Top-Lage mit direkter ÖV-Anbindung (Bahnhof Altstetten / Hauptbahnhof) -akzeptierter Wohnsitz beim Kreisbüro-Zimmergrösse: 20 qm, Bettgrösse: 140 x 200 cm, ruhige & angenehme Atmosphäre mit Sicherheitsdienst in der Nacht, tägliche Grundreinigung-Zimmeraustattung: Bett- und Bettwäsche, Frotteewäsche, LAN, Flat Screen TV, Kühlschrank, Wandschrank, Arbeitstisch und Bürostuhl-Küchen, Terasse, Duschen & Toiletten in Gemeinschaftsnutzung. Die Gemeinschaftsküchen sind mit abschliessbaren Boxen pro Mieter aufgeteilt. Jeder Mieter erhält seine eigenen Kochutensilien (befristete Mieter können diese mieten). Die Duschen & Toiletten sind auf jedem Stockwerk nach m /w unterteilt-Waschmaschinen, Tumbler (mit aufladbarer Chipkarte), Bügeleisen & Staubsauger kostenlos vorhanden**********************************************************************************instant move-in possible!conditions:rental contract: CHF 1090 + deposit CHF 2‘000+ one-time end cleaning CHF 150, period of notice: 3 months (double room only CHF 60 more)1 month stay: CHF 1'250+ one-time end cleaning CHF 150 (double room only CHF 50 more)2- 3 month stay each: CHF 1'150+ one-time end cleaning CHF 150(double room only CHF 50 more)Application: Online application on www.primestay.ch or via contact form from here Contact: Primestay Schweiz AG, zuerich@primestay.ch, +41 44 495 70 95 +41 79 800 70 95 Viewing: Please leave in the note a suggest when we could meet each other. We are there for you from 8 - 12 a.m. and from 1 - 5 p.m. Off-peak-hours-meetings just after special agreement.-Top-Location with direct connection (train station Altstetten / main train station of Zürich)-accepted for dwelling place by the registration office -Room size: 20 qm, bed size: 140 x 200 cm, quiet & cosy atmosphere with security service in the night, daily cleaning service-Room settings: bed & bed liners, towels, LAN, Flat Screen TV, fridge, wardrobe, work table and office seat-Kitchen, terrace, showers & toilets in shared using. Showers & toilets are separeted for m / w The kitchens are including boxes with kitchenstuff or to store the tenants kitchen stuff (for monthly residents for renting).-Wash machines, dryers (with chip-card), iron & vacuum cleaner are free available","Zürich, Kreis 9","(47.3803243, 8.4940369)",9,47.3803243, 8.4940369,54.5
28,Motorradeinstellplätze in der Nähe vom Bahnhof Zürich Affoltern,"Mühlackerstr. 102, 8046 Zürich",8046.0,Zürich,0.0,,60.0,CHF,Per Sofort oder nach Vereinbarung vermieten wir Motorradeinstellplätze in der Tiefgarage an der Mühlackerstrasse 102 in 8046 Zürich.Die Plätze kosten 60.00 CHF exklusive MWSt.Haben wir Ihr Interesse geweckt? Wir freuen uns auf Ihre Kontaktaufnahme.BVK - Die Pensionskasse mit attraktivem Wohnraum in der ganzen Schweiz. Tagesaktuell auf bvk-immobilien.ch.,"Zürich, Kreis 11","(47.4253204, 8.5005587)",1,47.4253204, 8.5005587,
29,Nähe Uni - Befristet bis 30.09.2017,Obstgartenstr. 36,8006.0,Zürich,1.0,28.0,870.0,CHF,"Per 1. Juli 2017 vermieten wir eine 1.5-Zimmer-Altbau-Wohnung befristet bis 30.09.2017. Die Wohnung verfügt über eine abgeschlossene Küche, Bad/WC, Kellerabteil. Ebenfalls ist ein Lift vorhanden.Bei den inserierten Fotos handelt es sich um eine ähnliche Wohnung. Abweichungen können daher vorkommen. Haben wir Ihr Interesse geweckt?Besichtigungstermine:- Mittwoch, 28. Juni 2017 von 18.00 - 18.30 UhrKlingeln bei Mieter Dieter!","Zürich, Kreis 6","(47.3833361, 8.542788751487)",6,47.3833361, 8.542788751487,31.071428571428573
30,Attraktives Ladenlokal,Dachslernstrasse 46,8048.0,Zürich,0.0,67.0,123.0,CHF,Ladenlokal und Lagerräume zu vermieten.Parkplätze können dazugemietet werden.Für weitere Angaben dürfen Sie sich gerne mit uns in Verbindung setzen.,"Zürich, Kreis 9","(47.3894865, 8.479078)",9,47.3894865, 8.479078,1.835820895522388
32,Mit Coworking inspirierend Arbeiten für Ihre persönlichen Projekte!,Leutschenbachstrasse 95,8050.0,Zürich,0.0,,86.0,CHF,"Das Regus Business Center im World Trade Center ist ein architektonisches Wahrzeichen im schnell wachsenden Geschäftsdistrikt Zürich-Nord. Dieses Zürcher Geschäftsviertel ist Sitz vieler nationaler und internationaler Unternehmen sowie des Schweizer Fernsehens. Das Regus Center WTC liegt ausgezeichnet zwischen internationalem Flughafen Zürich und Innenstadt.http://www.de.regus.ch/locations/office-space/zurich-world-trade-centerRegus Schweiz bietet Büroflächen von 5m2 bis zu mehr als 100m2. Jetzt Termin vereinbaren +41 (0)43 508 04 27!* Preis ""ab"" pro Person pro Monat für 1 Arbeitsplatz in einem voll ausgestatteten und gemeinsamen Büro. Angebot gültig je nach Verfügbarkeit und im Rahmen eines 24-Monats-Vertrages . Der Preis pro Quadratmeter berücksichtigt den Zugang zu öffentlichen Bereichen wie die Küche, die Business-Lounge und den Empfang mit hoch qualifiziertem, mehrsprachigem Personal. Monatsgebühr beinhaltet: Miete, Immobilienverwaltung, tägliche Reinigung, Möbel und Dekoration. Nur 2 Monate Kaution. Fotos nicht verbindlich.","Zürich, Kreis 11","(47.4178489, 8.5588659)",1,47.4178489, 8.5588659,
33,Motorradparkplatz zu vermieten,Uetlibergstrasse 130,8045.0,Zürich,0.0,,70.0,CHF,Parkplatz Nr. 45 per 1. Januar 2017 zu vermieten.Monatliche Miete je CHF 70.00 zuzüglich 8% Mwst,"Zürich, Kreis 3","(47.3605329, 8.5165707)",3,47.3605329, 8.5165707,
